"Примечания к консс (в тысячах рублях,",лимечания к тысячах руб,"олидированнои финансовои отчетности за год, закончившиися 31 декаоря 2UZZ года если в тексте не указано иное)"
Примечание 4,иМечание,Применение новых и уточненных стандартов интерпретаций международных стандартов финансовой отчетности (МСФО)
Новые стандарты закончившийся 31,вые станда 'КОНЧИВШИЙС,"которые вступили в силу в отношении годовой финансовой отчетности за год, декабря 2022 года, но не оказавшие значительного влияния на Группу:"
Основные cpe 16);,Основные 16);,дства Поступления до предполагаемого использования (поправки к МСФО (IAS
"Ежегодные усо 1, МСФО (IFRS) Ссылки на Конг","Ежегодны- 1, МСФО Ссылки на","овершенствования МСФО ЦИКл поправок 2018-2020 годов (поправки к МСФО (IFRS 9, МСФО (IFRS) 16 и МСФО (IAS) 41); цептуальные основы финансовой отчетности (поправки к МСФО (IFRS) 3)."
Ссылки на Коны Hon,Ссылки на,цептуальные основы финансовой отчетности (поправки к МСФО (IFRS) 3 ).
Новые стандарты Da п 7ганпарор,вые станда,"разъяснения и поправки, выпущенные, но еще не вступившие силу Г0 МАСф 7"
"Ряд стандартов, пС силу в будущих от Раскрытие уче",1д стандарто 1лу в будущу Раскрытие,"оправок к стандартам и разъяснениям, выпущенные Советом по МСФО, вступят ~четных периодах и не применены Группой досрочно: етной политики   (поправки К МСФО (IAS) И Практическим рекомендациям ПС"
применению M Определение года; Отложенный,примененг Определег года; Отложеннц,"АСФО Ng2) , вступают силу января 2023 года; бухгалтерских оценок (поправки к МСФО (IAS) 8), вступают в силу января 202 налог активов обязательств возникающих результате ОдНой операциV"
