8 M,uллцонах poccuucKux рублей
4,ОСНОВНЫЕ ПОЛОЖЕНИЯ УЧЕТНОЙ ПОЛИТИКИ (ПРОДОЛЖЕНИЕ)
"При подготовке консолидированной финансовой отчетности вce остатки по расчетам и операциям внутри Группы, a также нереализованные прибыли и убытки, возникающие результате операций внутри Группы, исключаются.",
Изменения доЛИ владения дочерних  организациях Группы; не приводящие к потере контроля; учитываются в составе капитала_,
В случае утраты контроля над дочерней   организацией Группа прекращает признание активов обязательств соответствующих компонентов капитала  бывшей   дочерней   организации: Любая возникающая результате ЭТОГО разница признается составе консолидированного отчета прибылях и убытках. Оставшаяся доля владения в бывшей дочерней организации признается по справедливой стоимости на дату утраты контроля:,
Функциональная валюта и валюта представления,
Индивидуальная финансовая отчетность каждой организации Группы представляется функциональной валюте:,
"Российский   рубль   (круб   или   Фрубльх) был определен качестве функциональной валюты Компании; вcex дочерних организаций, расположенных на территории Российской Федерации; всех иностранных дочерних организаций Группы; за исключением следующих дочерних организаций ввиду значительной степени их автономности. Функциональная валюта Norilsk Nickel Harjavalta Оу доллар США в 2020-2022 годах; Norilsk Nickel Africa Proprietary Limited и Nkomati Nickel Mine южноафриканский рэнд в 2020 и 2021 годах.",
B соответствии требованиями Федерального закона <208-ФЗ> валютой представления консолидированной   финансовой отчетности Группы является российский Группа также выпускает консолидированную финансовую отчетность использующую доллар США в качестве рубль:,
