8 M,uллuонах poccuйcкux рублей
4,ОСНОВНЫЕ ПОЛОЖЕНИЯ УЧЕТНОЙ ПОЛИТИКИ (ПРОДОЛЖЕНИЕ)
"Оценочные обязательства могут признаваться отношении социальных, экологических обязательств Группы и обязательств по выводу из эксплуатации ИЛИ прочих обязательств Группы и соответствующим образом представлены в данной консолидированной финансовой отчетности B частности; социальные оценочные обязательства Группы представлены вместе прочими обязательствами отношении социальных расходов качестве   отдельной статьи Социальные обязательства консолидированного отчета 0 финансовом положении",
"Сумма;  признанная качестве оценочного   обязательства; представляет собой  наиболее точную оценку затрат, необходимых для погашения текущего обязательства на отчетную дату, принимая во внимание риски и неопределенность связанные с обязательством: Если для расчета оценочного обязательства используются будущие денежные ПОТОКИ, балансовой стоимостью оценочного обязательства считается текущая стоимость таких денежных потоков",
Оценочные обязоиельсива no воссианоелению окруэксоючей среды и эколоеические обязамельсива,
Обязательства по восстановлению окружающей среды включают в себя прямые расходы по выводу основных средств из эксплуатации; aа также связанные расходы на рекультивацию земель:,
"Будущие расходы по выводу основных средств из эксплуатации и соответствующие обязательства отражаются По дисконтированной стоимости, когда у Группы возникают юридические ИЛИ обусловленные практикой обязательства в отношении данных расходов; и их величина может быть оценена достаточной степенью достоверности Расходы ПО выводу основных средств И3",
