8 M,uллчонах poccuicкuх рублей
4,ОСНОВНЫЕ ПОЛОЖЕНИЯ УЧЕТНОЙ ПОЛИТИКИ (ПРОДОЛЖЕНИЕ)
"Основные средства; используемые ДЛЯ добычи первичного обогащения; учитываются ПО первоначальной стоимости 3а вычетом сумм накопленной амортизации и обесценения: B стоимость основных средств, используемых для добычи первичного обогащения ВХОДИТ стоимость приобретения и строительства рудников, расходы; понесенные до начала производства; инфраструктура рудников; стоимость зданий; сооружений и оборудования для переработки добытой руды, стоимость прав на пользование недрами и лицензий на проведение добычных и поисково-разведочных работ также   капитализированные финансовые   расходы и текущая дисконтированная стоимость  будущих расходов по выводу основных средств из эксплуатации",
Балансовая стоимость основных средств; используемых для  добычи и первичного обогащения амортизируется течение наименьшего И3 двух периодов: полезного срока   службы объекта основных средств линейным методом; либо срока   службы рудника  Срок   службы рудника рассчитывается на основе производственного плана Группы В среднем сроки полезного использования составляЮт От до 47 лет,
Расходы на 2солоеоразееоочные рабоиы,
"Расходы на геологоразведочные работы; такие как геофизические; топографические; геологические аналогичные ВИдЫ работ, понесенные в рамках   поисково-оценочных лицензий и лицензий на разведку добычу;   капитализируются амортизируются течение срока службы  рудника момента подтверждения коммерческой целесообразности добычи. В противном случае расходы списываются в периоде в котором они произведены",
